{
  "schema_version": "0.1.0",
  "run_id": "20260814-data-claw-arxiv",
  "created_at": "2026-08-14T06:17:46+00:00",
  "host": "Codex Desktop",
  "model": "OpenAI Codex",
  "external_model_api_used": false,
  "analysis_basis": "full_text",
  "profile": "data-agent",
  "input_kind": "arxiv",
  "source_sha256": "038c793698ab91ec168f536621744d00a433ee4ef385f90986f0ca4484e13cfc",
  "validation_status": "pass",
  "warnings": [
    "The benchmark itself was not rerun; this is a paper-reading validation run.",
    "PDF text extraction occasionally merged two-column reading order; key pages were visually inspected."
  ]
}
